RAG/docs/evaluation_results_retriever.csv

strategy,retrieval_score_pct,faithfulness_yes,faithfulness_no,faithfulness_partial,faithfulness_unknown,avg_retrieval_time_s,avg_generation_time_s,avg_total_latency_s,avg_response_words
Semantic Retrieval,72,5,3,1,1,2.061,57.91,59.971,368
Hybrid Retrieval,62,6,4,0,0,2.592,63.775,66.367,364
Hybrid Retrieval - Fixed allocation (1 policy + 2 faq + 2 ticket),60,5,4,1,0,2.627,58.113,60.739,312
Hybrid Retrieval + metadata filtering (category),45,2,5,1,2,1.9,43.574,45.474,253
Hybrid Retrieval + metadata filtering (category + product),57,5,1,0,4,2.65,66.607,69.257,338
Hybrid Retrieval top8 + boost strategy,91,3,5,0,2,2.063,45.458,47.521,385
Hybrid Retrieval top8 + RRF,83,2,5,2,1,2.396,49.281,51.676,333
Hybrid Retrieval top8 + RRF + improved filtering before,85,3,5,0,2,2.621,39.267,41.888,339
Hybrid Retrieval top8 + RRF + improved filtering after,85,4,4,1,1,2.064,47.601,49.665,422
Hybrid Retrieval top8 + boost strategy + filtering,91,7,2,1,0,2.098,55.282,57.379,397
Hybrid Retrieval top8 + boost strategy + filtering + kw + prod boost,88,4,6,0,0,1.894,56.313,58.207,410
Hybrid Retrieval top5 + boost strategy + filtering + kw + prod boost,82,6,2,1,1,2.444,67.818,70.262,325

RAG/docs/evaluation_results_retrieval.md

## Semantic Retrieval

=== Evaluation Summary ===
    Total queries       : 10
    Avg retrieval score : 72%
    Faithfulness        : {'YES': 5, 'NO': 3, 'PARTIAL': 1, 'UNKNOWN': 1}
    Avg retrieval time  : 2.061s
    Avg generation time : 57.91s
    Avg total latency   : 59.971s
    Avg response words  : 368

## Hibrid Retrieval

=== Evaluation Summary ===
    Total queries       : 10
    Avg retrieval score : 62%
    Faithfulness        : {'YES': 6, 'NO': 4, 'PARTIAL': 0, 'UNKNOWN': 0}
    Avg retrieval time  : 2.592s
    Avg generation time : 63.775s
    Avg total latency   : 66.367s
    Avg response words  : 364

## Hybrid Retrieval - Formating Output 1 - policy; 2 - faq; 2 - ticket;

=== Evaluation Summary ===
    Total queries       : 10
    Avg retrieval score : 60%
    Faithfulness        : {'YES': 5, 'NO': 4, 'PARTIAL': 1, 'UNKNOWN': 0}
    Avg retrieval time  : 2.627s
    Avg generation time : 58.113s
    Avg total latency   : 60.739s
    Avg response words  : 312

## Hybrid Retrieval + metadata filtering (category)

=== Evaluation Summary ===
    Total queries       : 10
    Avg retrieval score : 45%
    Faithfulness        : {'YES': 2, 'NO': 5, 'PARTIAL': 1, 'UNKNOWN': 2}
    Avg retrieval time  : 1.9s
    Avg generation time : 43.574s
    Avg total latency   : 45.474s
    Avg response words  : 253

## Hibrid Retrieval + metadata filtering (category, product)

=== Evaluation Summary ===
    Total queries       : 10
    Avg retrieval score : 57%
    Faithfulness        : {'YES': 5, 'NO': 1, 'PARTIAL': 0, 'UNKNOWN': 4}
    Avg retrieval time  : 2.65s
    Avg generation time : 66.607s
    Avg total latency   : 69.257s
    Avg response words  : 338

## Hibrid Retrieval, Top8k + boost strategy

=== Evaluation Summary ===
    Total queries       : 10
    Avg retrieval score : 91%
    Faithfulness        : {'YES': 3, 'NO': 5, 'PARTIAL': 0, 'UNKNOWN': 2}
    Avg retrieval time  : 2.063s
    Avg generation time : 45.458s
    Avg total latency   : 47.521s
    Avg response words  : 385

## Hibrid Retrieval, Top-8k + RRF

=== Evaluation Summary ===
    Total queries       : 10
    Avg retrieval score : 83%
    Faithfulness        : {'YES': 2, 'NO': 5, 'PARTIAL': 2, 'UNKNOWN': 1}
    Avg retrieval time  : 2.396s
    Avg generation time : 49.281s
    Avg total latency   : 51.676s
    Avg response words  : 333

## Hibrid Retrieval, Top8k + RFF + improved filtering after

=== Evaluation Summary ===
    Total queries       : 10
    Avg retrieval score : 85%
    Faithfulness        : {'YES': 3, 'NO': 5, 'PARTIAL': 0, 'UNKNOWN': 2}
    Avg retrieval time  : 2.621s
    Avg generation time : 39.267s
    Avg total latency   : 41.888s
    Avg response words  : 339

# Hibrid Retrieval, Top8k RFF + improved filtering before

=== Evaluation Summary ===
    Total queries       : 10
    Avg retrieval score : 85%
    Faithfulness        : {'YES': 4, 'NO': 4, 'PARTIAL': 1, 'UNKNOWN': 1}
    Avg retrieval time  : 2.064s
    Avg generation time : 47.601s
    Avg total latency   : 49.665s
    Avg response words  : 422

# Hibrid Retrieval, Top8k + Boost strategy + filtering

=== Evaluation Summary ===
    Total queries       : 10
    Avg retrieval score : 91%
    Faithfulness        : {'YES': 7, 'NO': 2, 'PARTIAL': 1, 'UNKNOWN': 0}
    Avg retrieval time  : 2.098s
    Avg generation time : 55.282s
    Avg total latency   : 57.379s
    Avg response words  : 397

# Hibrid Retrieval, Top8k + Boost strategy + filtering + kw + prod boost

=== Evaluation Summary ===
    Total queries       : 10
    Avg retrieval score : 88%
    Faithfulness        : {'YES': 4, 'NO': 6, 'PARTIAL': 0, 'UNKNOWN': 0}
    Avg retrieval time  : 1.894s
    Avg generation time : 56.313s
    Avg total latency   : 58.207s
    Avg response words  : 410

# Hibrid Retrieval, Top5k + Boost strategy + filtering + kw + prod boost

=== Evaluation Summary ===
    Total queries       : 10
    Avg retrieval score : 82%
    Faithfulness        : {'YES': 6, 'NO': 2, 'PARTIAL': 1, 'UNKNOWN': 1}
    Avg retrieval time  : 2.444s
    Avg generation time : 67.818s
    Avg total latency   : 70.262s
    Avg response words  : 325