RAG/docs/evaluation_results_compressor.csv

strategy,relative_threshold_pct,retrieval_score_pct,faithfulness_yes,faithfulness_no,faithfulness_partial,faithfulness_unknown,avg_retrieval_time_s,avg_compression_time_s,avg_generation_time_s,avg_total_latency_s,avg_response_words
Before Compression,0,82,6,2,1,1,2.444,0.0,67.818,70.262,325
Compress 45%,45,78,8,1,1,0,1.871,0.0,45.528,47.399,236
Compress 50%,50,78,6,2,2,0,1.873,0.0,42.403,44.275,231
Compress 55%,55,78,5,2,3,0,1.929,0.0,46.07,47.999,233
Compress 60%,60,76,7,2,1,0,2.065,0.0,42.55,44.615,217
Compress 65%,65,76,6,2,2,0,1.865,0.0,40.99,42.855,210
Compress 50% + semantic,50,78,9,1,0,0,1.862,0.455,42.876,44.738,225

RAG/docs/evaluation_results_compressor.md

## Before Compress

=== Evaluation Summary ===
    Total queries       : 10
    Avg retrieval score : 82%
    Faithfulness        : {'YES': 6, 'NO': 2, 'PARTIAL': 1, 'UNKNOWN': 1}
    Avg retrieval time  : 2.444s
    Avg generation time : 67.818s
    Avg total latency   : 70.262s
    Avg response words  : 325

## Compress 45% Score

=== Evaluation Summary ===
    Total queries       : 10
    Avg retrieval score : 78%
    Faithfulness        : {'YES': 8, 'NO': 1, 'PARTIAL': 1, 'UNKNOWN': 0}
    Avg retrieval time  : 1.871s
    Avg generation time : 45.528s
    Avg total latency   : 47.399s
    Avg response words  : 236`

## Compress 50% Score

=== Evaluation Summary ===
    Total queries       : 10
    Avg retrieval score : 78%
    Faithfulness        : {'YES': 6, 'NO': 2, 'PARTIAL': 2, 'UNKNOWN': 0}
    Avg retrieval time  : 1.873s
    Avg generation time : 42.403s
    Avg total latency   : 44.275s
    Avg response words  : 231

## Compress 55%

=== Evaluation Summary ===
    Total queries       : 10
    Avg retrieval score : 78%
    Faithfulness        : {'YES': 5, 'NO': 2, 'PARTIAL': 3, 'UNKNOWN': 0}
    Avg retrieval time  : 1.929s
    Avg generation time : 46.07s
    Avg total latency   : 47.999s
    Avg response words  : 233

## Compress 60% Score

=== Evaluation Summary ===
    Total queries       : 10
    Avg retrieval score : 76%
    Faithfulness        : {'YES': 7, 'NO': 2, 'PARTIAL': 1, 'UNKNOWN': 0}
    Avg retrieval time  : 2.065s
    Avg generation time : 42.55s
    Avg total latency   : 44.615s
    Avg response words  : 217

## Compress 65% Score

=== Evaluation Summary ===
    Total queries       : 10
    Avg retrieval score : 76%
    Faithfulness        : {'YES': 6, 'NO': 2, 'PARTIAL': 2, 'UNKNOWN': 0}
    Avg retrieval time  : 1.865s
    Avg generation time : 40.99s
    Avg total latency   : 42.855s
    Avg response words  : 210

## Compress 50% + semantic and bm25 revine

=== Evaluation Summary ===
    Total queries       : 10
    Avg retrieval score : 78%
    Faithfulness        : {'YES': 9, 'NO': 1, 'PARTIAL': 0, 'UNKNOWN': 0}
    Avg retrieval time  : 1.862s
    Avg Lexical compression time: 0.001s
    Avg Semantic compression time: 0.455s
    Avg generation time : 42.876s
    Avg total latency   : 44.738s
    Avg response words  : 225