RAG/docs/evaluation_results_compressor_topk.csv

top_k,total_queries,avg_retrieval_score_pct,faithfulness_yes,faithfulness_no,faithfulness_partial,faithfulness_unknown,avg_helpfulness,avg_clarity,avg_professionalism,avg_completeness,avg_retrieval_time_s,avg_compression_time_s,avg_generation_time_s,avg_total_latency_s,avg_response_words
3,10,88,8,0,2,0,4.4,4.0,4.8,4.4,1.859,0.720,43.346,45.925,224
4,10,88,8,1,1,0,4.5,4.2,5.0,4.6,2.621,0.747,57.646,61.014,236
5,10,88,9,1,0,0,4.7,4.4,5.0,4.6,1.864,0.715,50.923,53.502,262
6,10,88,10,0,0,0,5.0,4.5,4.9,5.0,1.867,0.684,46.512,49.063,257
7,10,88,10,0,0,0,4.9,4.4,4.8,5.0,1.867,0.719,51.135,53.721,286
8,10,88,10,0,0,0,5.0,4.6,4.9,4.9,2.455,0.756,64.060,67.270,282
9,10,88,10,0,0,0,4.9,4.6,5.0,5.0,1.896,0.701,52.925,55.521,290
10,10,88,8,0,2,0,5.0,4.6,4.8,5.0,2.065,0.750,56.104,58.918,313

RAG/docs/evaluation_results_compressor_topk.md

## Top 3 Chunks

=== Evaluation Summary ===
    Total queries       : 10
    Avg retrieval score : 88%
    Faithfulness        : {'YES': 8, 'NO': 0, 'PARTIAL': 2, 'UNKNOWN': 0}
    Avg helpfulness     : 4.4/5
    Avg clarity         : 4.0/5
    Avg professionalism : 4.8/5
    Avg completeness    : 4.4/5
    Avg retrieval time  : 1.859s
    Avg compression time: 0.72s
    Avg generation time : 43.346s
    Avg total latency   : 45.925s
    Avg response words  : 224

## Top 4 Chunks

=== Evaluation Summary ===
    Total queries       : 10
    Avg retrieval score : 88%
    Faithfulness        : {'YES': 8, 'NO': 1, 'PARTIAL': 1, 'UNKNOWN': 0}
    Avg helpfulness     : 4.5/5
    Avg clarity         : 4.2/5
    Avg professionalism : 5.0/5
    Avg completeness    : 4.6/5
    Avg retrieval time  : 2.621s
    Avg compression time: 0.747s
    Avg generation time : 57.646s
    Avg total latency   : 61.014s
    Avg response words  : 236

## Top 5 Chunks

=== Evaluation Summary ===
    Total queries       : 10
    Avg retrieval score : 88%
    Faithfulness        : {'YES': 9, 'NO': 1, 'PARTIAL': 0, 'UNKNOWN': 0}
    Avg helpfulness     : 4.7/5
    Avg clarity         : 4.4/5
    Avg professionalism : 5.0/5
    Avg completeness    : 4.6/5
    Avg retrieval time  : 1.864s
    Avg compression time: 0.715s
    Avg generation time : 50.923s
    Avg total latency   : 53.502s
    Avg response words  : 262`

## Top 6 Chunks

=== Evaluation Summary ===
    Total queries       : 10
    Avg retrieval score : 88%
    Faithfulness        : {'YES': 10, 'NO': 0, 'PARTIAL': 0, 'UNKNOWN': 0}
    Avg helpfulness     : 5.0/5
    Avg clarity         : 4.5/5
    Avg professionalism : 4.9/5
    Avg completeness    : 5.0/5
    Avg retrieval time  : 1.867s
    Avg compression time: 0.684s
    Avg generation time : 46.512s
    Avg total latency   : 49.063s
    Avg response words  : 257

## Top 7 Chunks

=== Evaluation Summary ===
    Total queries       : 10
    Avg retrieval score : 88%
    Faithfulness        : {'YES': 10, 'NO': 0, 'PARTIAL': 0, 'UNKNOWN': 0}
    Avg helpfulness     : 4.9/5
    Avg clarity         : 4.4/5
    Avg professionalism : 4.8/5
    Avg completeness    : 5.0/5
    Avg retrieval time  : 1.867s
    Avg compression time: 0.719s
    Avg generation time : 51.135s
    Avg total latency   : 53.721s
    Avg response words  : 286

## Top 8 Chunks

=== Evaluation Summary ===
    Total queries       : 10
    Avg retrieval score : 88%
    Faithfulness        : {'YES': 10, 'NO': 0, 'PARTIAL': 0, 'UNKNOWN': 0}
    Avg helpfulness     : 5.0/5
    Avg clarity         : 4.6/5
    Avg professionalism : 4.9/5
    Avg completeness    : 4.9/5
    Avg retrieval time  : 2.455s
    Avg compression time: 0.756s
    Avg generation time : 64.06s
    Avg total latency   : 67.27s
    Avg response words  : 282

## Top 9 Chunks

=== Evaluation Summary ===
    Total queries       : 10
    Avg retrieval score : 88%
    Faithfulness        : {'YES': 10, 'NO': 0, 'PARTIAL': 0, 'UNKNOWN': 0}
    Avg helpfulness     : 4.9/5
    Avg clarity         : 4.6/5
    Avg professionalism : 5.0/5
    Avg completeness    : 5.0/5
    Avg retrieval time  : 1.896s
    Avg compression time: 0.701s
    Avg generation time : 52.925s
    Avg total latency   : 55.521s
    Avg response words  : 290

## Top 10 Chunks

=== Evaluation Summary ===
    Total queries       : 10
    Avg retrieval score : 88%
    Faithfulness        : {'YES': 8, 'NO': 0, 'PARTIAL': 2, 'UNKNOWN': 0}
    Avg helpfulness     : 5.0/5
    Avg clarity         : 4.6/5
    Avg professionalism : 4.8/5
    Avg completeness    : 5.0/5
    Avg retrieval time  : 2.065s
    Avg compression time: 0.75s
    Avg generation time : 56.104s
    Avg total latency   : 58.918s
    Avg response words  : 313